<!ELEMENT menu (item+)>

<!ELEMENT item (name, category, type, price)>

<!ELEMENT name (#PCDATA)>
<!ELEMENT category (#PCDATA)>
<!ELEMENT type (#PCDATA)>
<!ELEMENT price (#PCDATA)>
